url,company,publishedAt,title,description
https://techcrunch.com/2025/10/02/openai-is-the-worlds-most-valuable-private-company-after-private-stock-sale/,Nvidia,2025-10-02T14:38:02Z,OpenAI is the world's most valuable private company after private stock sale | TechCrunch,OpenAI is the world's most valuable private company after private stock sale | TechCrunchtechcrunch.com
https://www.cnbc.com/2025/10/02/cnbcs-inside-india-newsletter-indias-gigawatt-gold-rush.html,Nvidia,2025-10-02T12:03:58Z,CNBC's Inside India newsletter: India’s gigawatt gold rush,"India’s data center sector is in the middle of a gold rush, with global giants, billionaires and even luxury property developers piling in."
https://www.bloomberg.com/news/articles/2025-10-02/global-chipmakers-add-200-billion-in-record-rally-on-ai-frenzy,Nvidia,2025-10-02T08:14:58Z,Global chipmakers add $200 billion in record rally on AI frenzy,"The sector is being swept up by a wave of good news from AI companies, including ChatGPT-owner OpenAI’s record $500 billion valuation on an employee share sale"
https://www.cnbc.com/2025/10/01/cramer-says-that-q3-winners-may-keep-inching-higher-but-the-biggest-gains-may-have-already-been-made.html,Nvidia,2025-10-01T23:12:39Z,Cramer says that Q3 winners may keep inching higher but the biggest gains may 'have already been made',Cramer said that the biggest winners of the third quarter may keep inching higher but the biggest gains may have already been realized.
https://www.cnbc.com/2025/10/01/microsoft-makes-sales-chief-althoff-ceo-of-commercial-business.html,Nvidia,2025-10-01T20:37:19Z,Microsoft sales chief Althoff gets new role as CEO of company's commercial business,"Bringing together sales with marketing and other functions is critical for Microsoft to lead in the artificial intelligence era, CEO Satya Nadella said."
https://techcrunch.com/2025/10/01/californias-new-ai-safety-law-shows-regulation-and-innovation-dont-have-to-clash/,Nvidia,2025-10-01T20:02:00Z,California’s new AI safety law shows regulation and innovation don’t have to clash  | TechCrunch,"“Are bills like SB 53 the thing that will stop us from beating China? No,” said Adam Billen, vice president of public policy at youth-led advocacy group Encode AI. “I think it is just genuinely intellectually dishonest to say that that is the thing that will …"
https://www.cnbc.com/2025/10/01/intel-stock-amd-chips.html,Nvidia,2025-10-01T18:33:44Z,Intel stock pops on news company is in early talks to add AMD as a customer,"The U.S. government, Nvidia and Softbank have all taken recent stakes in Intel."
https://techcrunch.com/2025/10/01/openais-new-social-app-is-filled-with-terrifying-sam-altman-deepfakes/,Nvidia,2025-10-01T18:04:30Z,OpenAI's new social app is filled with terrifying Sam Altman deepfakes | TechCrunch,OpenAI's new social app is filled with terrifying Sam Altman deepfakes | TechCrunchtechcrunch.com
https://www.cnbc.com/2025/10/01/microsoft-makes-co.html,Nvidia,2025-10-01T16:03:01Z,Microsoft sales chief Althoff gets new role as CEO of company's commercial business,"Bringing together sales with marketing and other functions is critical for Microsoft to lead in the artificial intelligence era, CEO Satya Nadella said."
https://www.cnbc.com/2025/10/01/microsoft-wants-to-mainly-use-its-own-ai-chips-in-the-future.html,Nvidia,2025-10-01T14:07:20Z,Microsoft wants to mainly use its own AI data center chips in the future,Microsoft has been developing its own chips for the data center designed to handle artificial intelligence workloads.
https://techcrunch.com/2025/10/03/flai-is-the-latest-startup-bringing-ai-to-car-dealerships/,Netflix,2025-10-03T14:02:43Z,Flai is the latest startup bringing AI to car dealerships | TechCrunch,The YC-backed startup has raised a $4.5 million seed round as it looks to win over more businesses by replacing cumbersome phone trees with AI-powered software.
https://www.bloomberg.com/news/articles/2025-10-01/netflix-wins-dismissal-of-squid-game-suit-by-indian-filmmaker,Netflix,2025-10-03T04:18:19Z,Netflix wins dismissal of ‘Squid Game’ suit by Indian filmmaker,"Netflix wins dismissal of lawsuit by Indian filmmaker over Squid Game, deemed not a copy of Luck."
https://www.cnbc.com/2025/10/02/elon-musk-calls-for-canceling-netflix-whats-happening.html,Netflix,2025-10-02T19:58:22Z,Elon Musk is telling his followers to cancel Netflix subscriptions. Here's what's happening,Elon Musk this week urged his followers to cancel their Netflix subscriptions over a controversy surrounding an animated show and its creator.
https://www.cnbc.com/2025/10/01/peloton-revamps-equipment-raises-prices-ahead-of-holidays-.html,Netflix,2025-10-01T11:00:01Z,"Peloton revamps equipment, launches commercial unit and raises prices ahead of holidays",Peloton is revamping its product assortment and raising prices for its subscription and hardware ahead of the holiday shopping season.
